{
  "_comment": "generated by software_inventory.py (Tooling#424); do not hand-edit -- put fixes in software-inventory.overrides.json",
  "repos": ["Rackbops/Tooling", "Rackbops/rackbops-discord-bot"],
  "readOnly": ["Lepid-Labs/LoreHearth", "Lepid-Labs/Lorepath"],
  "items": [
    {
      "repo": "Lepid-Labs/LoreHearth",
      "kind": "github-action",
      "name": "amannn/action-semantic-pull-request",
      "pinned": "v5",
      "pinStyle": "major",
      "role": "ci",
      "source": ".github/workflows/pr-guidelines.yml:14",
      "resolver": "gh-tag"
    },
    {
      "repo": "Lepid-Labs/Lorepath",
      "kind": "compose-image",
      "name": "lorearc/lorepath",
      "pinned": "latest",
      "pinStyle": "floating",
      "role": "infra",
      "source": "docker-compose.deploy.yml:11",
      "resolver": "ghcr"
    },
    {
      "repo": "Lepid-Labs/Lorepath",
      "kind": "dockerfile-base",
      "name": "node",
      "pinned": "24-alpine",
      "pinStyle": "major",
      "role": "build",
      "source": "Dockerfile:6",
      "resolver": "dockerhub"
    },
    {
      "repo": "Lepid-Labs/Lorepath",
      "kind": "npm-dep",
      "name": "@lorepath/core",
      "pinned": "workspace:*",
      "pinStyle": "floating",
      "role": "runtime",
      "source": "apps/web/package.json:14",
      "resolver": "npm"
    },
    {
      "repo": "Lepid-Labs/Lorepath",
      "kind": "npm-dep",
      "name": "@sveltejs/kit",
      "pinned": "^2.63.0",
      "pinStyle": "major",
      "role": "build",
      "source": "apps/web/package.json:26",
      "resolver": "npm"
    },
    {
      "repo": "Lepid-Labs/Lorepath",
      "kind": "npm-dep",
      "name": "idb",
      "pinned": "^8.0.0",
      "pinStyle": "major",
      "role": "runtime",
      "source": "apps/web/package.json:22",
      "resolver": "npm"
    },
    {
      "repo": "Lepid-Labs/Lorepath",
      "kind": "npm-dep",
      "name": "svelte",
      "pinned": "^5.56.1",
      "pinStyle": "major",
      "role": "build",
      "source": "apps/web/package.json:28",
      "resolver": "npm"
    },
    {
      "repo": "Lepid-Labs/Lorepath",
      "kind": "runtime-pin",
      "name": "pnpm",
      "pinned": "11.17.0",
      "pinStyle": "exact",
      "role": "runtime",
      "source": "package.json:16",
      "resolver": "gh-release"
    },
    {
      "repo": "Rackbops/Tooling",
      "kind": "pip-dep",
      "name": "pytest",
      "pinned": ">=8,<10",
      "pinStyle": "major",
      "role": "test",
      "source": "requirements-dev.txt:4",
      "resolver": "pypi"
    },
    {
      "repo": "Rackbops/rackbops-discord-bot",
      "kind": "compose-image",
      "name": "cloudflare/cloudflared",
      "pinned": "2026.8.3",
      "pinStyle": "exact",
      "role": "infra",
      "source": "docker-compose.yml:112",
      "resolver": "dockerhub"
    }
  ]
}
